{
  "$schema": "qualification-v1.schema.json",
  "schema_version": 1,
  "run_id": "fixture-pass",
  "evidence_kind": "aggregate",
  "mode": "fixture",
  "complete": true,
  "outcome": "pass",
  "generated_at": "2026-08-29T00:00:00Z",
  "environment": {
    "git_commit": "0123456789abcdef",
    "git_dirty": false,
    "os": "fixture-os",
    "arch": "fixture-arch",
    "cargo_profile": null,
    "tools": {},
    "metadata": {}
  },
  "summary": {
    "total": 1,
    "passed": 1,
    "failed": 0,
    "invalid": 0,
    "skipped": 0,
    "counts": {}
  },
  "mutants": [],
  "faults": [],
  "checks": [
    {
      "id": "fixture",
      "outcome": "pass",
      "exit_code": 0,
      "artifact": null,
      "metadata": {}
    }
  ],
  "errors": [],
  "artifacts": [
    {
      "kind": "fixture",
      "path": "fixture.txt",
      "present": true,
      "size_bytes": 8,
      "metadata": {}
    }
  ],
  "metadata": {}
}
